{
  "schema": "echelon.resolved-release-set/v1",
  "profile": {
    "id": "dokimos-proof",
    "version": "0.1.0",
    "sha256": "cc738238d126c35ec847badf56f58a507380f4b52a51a528ffb2dd240aa0a71b"
  },
  "platform": "linux-x64",
  "resolver": {
    "name": "echelon-registry-resolver",
    "version": "0.1.0"
  },
  "catalogSnapshot": {
    "sha256": "32c2e420a621d7e287950e3ec7c914bfd17136d2a606f42bebb4090b04a70779"
  },
  "components": [
    {
      "systemId": "dokimos",
      "role": "repository-lifecycle",
      "required": true,
      "version": "0.2.0",
      "repository": "kemiller2002/dokimos",
      "tag": "dokimos-v0.2.0",
      "commit": "e641048c52edd8755c2964b6bafa4ae860e34062",
      "releaseStage": "stable",
      "lifecycleState": "active",
      "distributionClass": "self-contained-native-cli",
      "executable": "dokimos",
      "repositoryLifecycle": {
        "contract": "echelon.repository-lifecycle",
        "contractVersion": 1
      },
      "releaseManifest": {
        "schema": "echelon.release/v2",
        "sha256": "1c75d80b9eb76a47239f2db7163c8e9e2f10e4ad303cd487284afd14c5a56737"
      },
      "distribution": {
        "mechanism": "github-release",
        "package": null,
        "url": "https://github.com/kemiller2002/dokimos/releases/tag/dokimos-v0.2.0"
      },
      "artifacts": [
        {
          "name": "dokimos-linux-x64.tar.gz",
          "purpose": "executable",
          "platform": "linux-x64",
          "sha256": "bb61505cf8fa23bf6b0992019ca2e2805bda46eeba42eecde9497e15a060441a"
        },
        {
          "name": "dokimos-checksums.txt",
          "purpose": "checksums",
          "platform": null,
          "sha256": "bcdb3676c409ae47ec083bbc016ce65d41a137fd305d367ff3923d0221298acc"
        },
        {
          "name": "LICENSE",
          "purpose": "licenses",
          "platform": null,
          "sha256": "e26da7c631b207a3ea65b0eb4761774fa246183e2855c52001d080b41577e9f2"
        }
      ]
    }
  ]
}
